<?xml version="1.0" encoding="UTF-8"?>
<p:json_generic_mango_v1 
	name="" 
	version="" 
	xmlns:p="json_generic_mango_v1" 
	xmlns:xsi="http://www.w3.org/2001/XMLSchema-instance" 
	xsi:schemaLocation="json_generic_mango_v1 ../../../adapter-lib/src/main/resources/schemas/mango/json_generic_mango_v1.xsd "
	element_type_id="32">
  <p:session_uid element_type_param_id="1003" param_type_id="1"></p:session_uid>
  <p:state field="status">
    <p:state_value source="0" input="2" disconnected="true"></p:state_value>
    <p:state_value source="1" input="1"></p:state_value>
  </p:state>
    <p:fields>
    <p:field>
      <p:source>local_remote</p:source>
      <p:input>
        <p:element_type_param_id>1</p:element_type_param_id>
        <p:param_type_id>2</p:param_type_id>
      </p:input>
    </p:field>
    <p:field>
      <p:source>fan_running</p:source>
      <p:input>
        <p:element_type_param_id>4</p:element_type_param_id>
        <p:param_type_id>2</p:param_type_id>
      </p:input>
    </p:field>
    <p:field>
      <p:source>reset_alarms</p:source>
      <p:input>
        <p:element_type_param_id>5</p:element_type_param_id>
        <p:param_type_id>2</p:param_type_id>
      </p:input>
    </p:field>
	<p:field>
      <p:source>parcial_operating_hours</p:source>
      <p:input>
        <p:element_type_param_id>6</p:element_type_param_id>
        <p:param_type_id>2</p:param_type_id>
      </p:input>
    </p:field>
    	<p:field>
      <p:source>total_operating_hours</p:source>
      <p:input>
        <p:element_type_param_id>7</p:element_type_param_id>
        <p:param_type_id>2</p:param_type_id>
      </p:input>
    </p:field>
  </p:fields>
  <p:alarms>
    <p:alarm source="fan_fail" active_value="true" alarm_config_id="3204"></p:alarm>
    <p:alarm source="fan_fail_stop" active_value="true" alarm_config_id="3202"></p:alarm>
    <p:alarm source="fan_fail_start" active_value="true" alarm_config_id="3203"></p:alarm>   
  </p:alarms>
</p:json_generic_mango_v1>