<?xml version="1.0" encoding="UTF-8"?>
<p:json_generic_mango_v1 
	name="" 
	version="" 
	xmlns:p="json_generic_mango_v1" 
	xmlns:xsi="http://www.w3.org/2001/XMLSchema-istance" 
	xsi:schemaLocation="json_generic_mango_v1 ../../../adapter-lib/src/main/resources/schemas/mango/json_generic_mango_v1.xsd "
	element_type_id="71" array_element_id="5,6,10,11,14,39,80,81,82,83,84,85,86,87,88,89,90">
  <p:groovy_adapter file="InputAdapter_VMS_DGT_22.groovy"></p:groovy_adapter>
  <p:session_uid element_type_param_id="1003" param_type_id="1"></p:session_uid>
  <p:state field="status">
    <p:state_value source="0" input="2" disconnected="true"></p:state_value>
    <p:state_value source="1" input="1"></p:state_value>
  </p:state>
  <p:fields>
    <p:field>
      <p:source>content</p:source>
	  <p:use_adapter>true</p:use_adapter>
    </p:field>
  <p:field>
      <p:source>travel_time_enabled</p:source>
      <p:input>
        <p:element_type_param_id>10</p:element_type_param_id>
        <p:param_type_id>2</p:param_type_id>
      </p:input>
    </p:field>
  </p:fields>
</p:json_generic_mango_v1>

