<?xml version="1.0" encoding="UTF-8"?>
<p:json_generic_mango_v1 
	name="" 
	version="" 
	xmlns:p="json_generic_mango_v1" 
	xmlns:xsi="http://www.w3.org/2001/XMLSchema-instance" 
	xsi:schemaLocation="json_generic_mango_v1 ../../../adapter-lib/src/main/resources/schemas/mango/json_generic_mango_v1.xsd "
	element_type_id="25" array_element_id="38,39,40,41,42,43,44">
  <p:session_uid element_type_param_id="1003" param_type_id="1"></p:session_uid>
  <p:state field="status">
    <p:state_value source="0" input="2" disconnected="true"></p:state_value>
    <p:state_value source="1" input="1"></p:state_value>
  </p:state>
  <p:alarms>
    <p:alarm source="door_open" active_value="false" alarm_config_id="030025"></p:alarm>
    <p:alarm source="overvoltage" active_value="true" alarm_config_id="080025"></p:alarm>
  </p:alarms>
</p:json_generic_mango_v1>