<?xml version="1.0" encoding="UTF-8"?>
<p:json_generic_mango_v1 
	name="" 
	version="" 
	xmlns:p="json_generic_mango_v1" 
	xmlns:xsi="http://www.w3.org/2001/XMLSchema-instance" 
	xsi:schemaLocation="json_generic_mango_v1 ../../../adapter-lib/src/main/resources/schemas/mango/json_generic_mango_v1.xsd "
	element_type_id="48">
  <p:session_uid element_type_param_id="1003" param_type_id="1"></p:session_uid>
  <p:state field="status">
    <p:state_value source="0" input="2" disconnected="true"></p:state_value>
    <p:state_value source="1" input="1"></p:state_value>
  </p:state>
  <p:fields>
    <p:field>
      <p:source>opening_gate</p:source>
      <p:input>
        <p:element_type_param_id>1</p:element_type_param_id>
        <p:param_type_id>2</p:param_type_id>
      </p:input>
    </p:field>
    <p:field>
      <p:source>gate_opened</p:source>
      <p:input>
        <p:element_type_param_id>2</p:element_type_param_id>
        <p:param_type_id>2</p:param_type_id>
      </p:input>
    </p:field>
  </p:fields>
  <p:alarms>
  	<p:alarm source="selector_auto_manual" active_value="false" alarm_config_id="020048"></p:alarm> 
    <p:alarm source="gate_going_down" active_value="true" alarm_config_id="030048"></p:alarm>
    <p:alarm source="gate_malfunction" active_value="true" alarm_config_id="040048"></p:alarm>
    <p:alarm source="gate_lowered" active_value="true" alarm_config_id="050048"></p:alarm>    
  </p:alarms>
</p:json_generic_mango_v1>
