<?xml version="1.0" encoding="UTF-8"?>
<p:json_generic_mango_v1 
	name="" 
	version="" 
	xmlns:p="json_generic_mango_v1" 
	xmlns:xsi="http://www.w3.org/2001/XMLSchema-instance" 
	xsi:schemaLocation="json_generic_mango_v1 ../../../adapter-lib/src/main/resources/schemas/mango/json_generic_mango_v1.xsd "
	element_type_id="75">
  <p:session_uid element_type_param_id="1003" param_type_id="1"></p:session_uid>
  <p:state field="status">
    <p:state_value source="0" input="2" disconnected="true"></p:state_value>
    <p:state_value source="1" input="1"></p:state_value>
  </p:state>
  <p:fields>
    <p:field>
      <p:source>grp_corriente_fase_1</p:source>
      <p:input>
        <p:element_type_param_id>1</p:element_type_param_id>
        <p:param_type_id>2</p:param_type_id>
      </p:input>
    </p:field>
    <p:field>
      <p:source>grp_corriente_fase_2</p:source>
      <p:input>
        <p:element_type_param_id>2</p:element_type_param_id>
        <p:param_type_id>2</p:param_type_id>
      </p:input>
    </p:field>
    <p:field>
      <p:source>grp_corriente_fase_3</p:source>
      <p:input>
        <p:element_type_param_id>3</p:element_type_param_id>
        <p:param_type_id>2</p:param_type_id>
      </p:input>
    </p:field>
    <p:field>
      <p:source>grp_frecuencia_salida</p:source>
      <p:input>
        <p:element_type_param_id>4</p:element_type_param_id>
        <p:param_type_id>2</p:param_type_id>
      </p:input>
    </p:field>
    <p:field>
      <p:source>grp_horas_tot_marcha</p:source>
      <p:input>
        <p:element_type_param_id>5</p:element_type_param_id>
        <p:param_type_id>2</p:param_type_id>
      </p:input>
    </p:field>
    <p:field>
      <p:source>grp_rpm_generador</p:source>
      <p:input>
        <p:element_type_param_id>6</p:element_type_param_id>
        <p:param_type_id>2</p:param_type_id>
      </p:input>
    </p:field>
    <p:field>
      <p:source>grp_tension_bateria</p:source>
      <p:input>
        <p:element_type_param_id>7</p:element_type_param_id>
        <p:param_type_id>2</p:param_type_id>
      </p:input>
    </p:field>
    <p:field>
      <p:source>grp_tension_salida_gen</p:source>
      <p:input>
        <p:element_type_param_id>8</p:element_type_param_id>
        <p:param_type_id>2</p:param_type_id>
      </p:input>
    </p:field>
    <p:field>
      <p:source>grp_modo_operacion_off</p:source>
      <p:input>
        <p:element_type_param_id>9</p:element_type_param_id>
        <p:param_type_id>2</p:param_type_id>
      </p:input>
    </p:field>
    <p:field>
      <p:source>grp_modo_operacion_man</p:source>
      <p:input>
        <p:element_type_param_id>10</p:element_type_param_id>
        <p:param_type_id>2</p:param_type_id>
      </p:input>
    </p:field>
    <p:field>
      <p:source>grp_modo_operacion_aut</p:source>
      <p:input>
        <p:element_type_param_id>11</p:element_type_param_id>
        <p:param_type_id>2</p:param_type_id>
      </p:input>
    </p:field>
    <p:field>
      <p:source>grp_vol_gen_L1_N</p:source>
      <p:input>
        <p:element_type_param_id>12</p:element_type_param_id>
        <p:param_type_id>2</p:param_type_id>
      </p:input>
    </p:field>
    <p:field>
      <p:source>grp_vol_gen_L2_N</p:source>
      <p:input>
        <p:element_type_param_id>13</p:element_type_param_id>
        <p:param_type_id>2</p:param_type_id>
      </p:input>
    </p:field>
    <p:field>
      <p:source>grp_vol_gen_L3_N</p:source>
      <p:input>
        <p:element_type_param_id>14</p:element_type_param_id>
        <p:param_type_id>2</p:param_type_id>
      </p:input>
    </p:field>
    <p:field>
      <p:source>grp_gas_level</p:source>
      <p:input>
        <p:element_type_param_id>15</p:element_type_param_id>
        <p:param_type_id>2</p:param_type_id>
      </p:input>
    </p:field>
    <p:field>
      <p:source>grp_temp_rad</p:source>
      <p:input>
        <p:element_type_param_id>16</p:element_type_param_id>
        <p:param_type_id>2</p:param_type_id>
      </p:input>
    </p:field>
    <p:field>
      <p:source>grp_kwh</p:source>
      <p:input>
        <p:element_type_param_id>17</p:element_type_param_id>
        <p:param_type_id>2</p:param_type_id>
      </p:input>
    </p:field>
  </p:fields>
  <p:alarms>
    <p:alarm source="grp_alarma_temperatura" active_value="true" alarm_config_id="223"></p:alarm>
    <p:alarm source="grp_alarma_general" active_value="true" alarm_config_id="224"></p:alarm>
    <p:alarm source="grp_motor_encendido" active_value="true" alarm_config_id="225"></p:alarm>
    <p:alarm source="grp_nivel_combust_rsv" active_value="true" alarm_config_id="226"></p:alarm>
  </p:alarms>
</p:json_generic_mango_v1>

