<?xml version="1.0" encoding="UTF-8"?>
<p:json_generic_mango_v1 name="" version=""
	xmlns:p="json_generic_mango_v1"
	xmlns:xsi="http://www.w3.org/2001/XMLSchema-instance"
	xsi:schemaLocation="json_generic_mango_v1 ../../../adapter-lib/src/main/resources/schemas/mango/json_generic_mango_v1.xsd "
	element_type_id="28">
	<p:groovy_adapter file="VmsMat192ParamsAdapter.groovy"></p:groovy_adapter>
	<p:session_uid element_type_param_id="1003"
		param_type_id="1"></p:session_uid>
	<p:state field="status">
		<p:state_value source="0" input="2" disconnected="true"></p:state_value>
		<p:state_value source="1" input="1"></p:state_value>
	</p:state>
	<p:fields>
		<p:field>
			<p:source>brightness</p:source>
			<p:input>
				<p:element_type_param_id>1</p:element_type_param_id>
				<p:param_type_id>2</p:param_type_id>
			</p:input>
		</p:field>
		<p:field>
			<p:source>brightness_ctrl</p:source>
			<p:input>
				<p:element_type_param_id>2</p:element_type_param_id>
				<p:param_type_id>2</p:param_type_id>
			</p:input>
		</p:field>
		<p:field>
			<p:source>temperature</p:source>
			<p:input>
				<p:element_type_param_id>3</p:element_type_param_id>
				<p:param_type_id>2</p:param_type_id>
			</p:input>
		</p:field>
		<p:field>
			<p:source>current_message_multistring</p:source>
			<p:use_adapter>true</p:use_adapter>
		</p:field>
	</p:fields>
	<p:alarms>
		<p:alarm source="pixel_error" active_value="1"
			alarm_config_id="88"></p:alarm>
		<p:alarm source="photocell_error" active_value="1"
			alarm_config_id="89"></p:alarm>
		<p:alarm source="temp_warning_error" active_value="1"
			alarm_config_id="90"></p:alarm>
		<p:alarm source="temp_critical_error" active_value="1"
			alarm_config_id="91"></p:alarm>
		<p:alarm source="door_open_error" active_value="1"
			alarm_config_id="92"></p:alarm>
	</p:alarms>
</p:json_generic_mango_v1>