<?xml version="1.0" encoding="UTF-8"?>
<p:json_generic_mango_v1 
	name="" 
	version="" 
	xmlns:p="json_generic_mango_v1" 
	xmlns:xsi="http://www.w3.org/2001/XMLSchema-instance" 
	xsi:schemaLocation="json_generic_mango_v1 ../../../adapter-lib/src/main/resources/schemas/mango/json_generic_mango_v1.xsd "
	element_type_id="11">
  <p:session_uid element_type_param_id="1003" param_type_id="1"></p:session_uid>
  <p:state field="status">
    <p:state_value source="0" input="2" disconnected="true"></p:state_value>
    <p:state_value source="1" input="1"></p:state_value>
  </p:state>
  <p:fields>
    <p:field>
      <p:source>vol_mic_reader</p:source>
      <p:input>
        <p:element_type_param_id>1</p:element_type_param_id>
        <p:param_type_id>2</p:param_type_id>
      </p:input>
    </p:field>
    <p:field>
      <p:source>vol_audio_reader</p:source>
      <p:input>
        <p:element_type_param_id>4</p:element_type_param_id>
        <p:param_type_id>2</p:param_type_id>
      </p:input>
    </p:field>
    <p:field>
      <p:source>test_audio_reader</p:source>
      <p:input>
        <p:element_type_param_id>5</p:element_type_param_id>
        <p:param_type_id>2</p:param_type_id>
      </p:input>
    </p:field>
    <p:field>
      <p:source>last_day_test</p:source>
      <p:input>
        <p:element_type_param_id>6</p:element_type_param_id>
        <p:param_type_id>2</p:param_type_id>
      </p:input>
    </p:field>
    <p:field>
      <p:source>last_month_test</p:source>
      <p:input>
        <p:element_type_param_id>7</p:element_type_param_id>
        <p:param_type_id>2</p:param_type_id>
      </p:input>
    </p:field>
    <p:field>
      <p:source>last_year_test</p:source>
      <p:input>
        <p:element_type_param_id>8</p:element_type_param_id>
        <p:param_type_id>2</p:param_type_id>
      </p:input>
    </p:field>
    <p:field>
      <p:source>last_hour_test</p:source>
      <p:input>
        <p:element_type_param_id>9</p:element_type_param_id>
        <p:param_type_id>2</p:param_type_id>
      </p:input>
    </p:field>
    <p:field>
      <p:source>last_minute_test</p:source>
      <p:input>
        <p:element_type_param_id>10</p:element_type_param_id>
        <p:param_type_id>2</p:param_type_id>
      </p:input>
    </p:field>
    <p:field>
      <p:source>last_second_test</p:source>
      <p:input>
        <p:element_type_param_id>11</p:element_type_param_id>
        <p:param_type_id>2</p:param_type_id>
      </p:input>
    </p:field>
    <p:field>
      <p:source>foghorn_state</p:source>
      <p:input>
        <p:element_type_param_id>14</p:element_type_param_id>
        <p:param_type_id>2</p:param_type_id>
      </p:input>
    </p:field>
  </p:fields>
  <p:alarms>
    <p:alarm source="sos_door_open" active_value="false" alarm_config_id="42"></p:alarm>
    <p:alarm source="extinguisher_door_open" active_value="false" alarm_config_id="306"></p:alarm>
    <p:alarm source="extinguisher_extraction" active_value="false" alarm_config_id="307"></p:alarm>
    <p:alarm source="sip" active_value="true" alarm_config_id="11001"></p:alarm>
  </p:alarms>
</p:json_generic_mango_v1>