<?xml version="1.0" encoding="UTF-8"?>
<p:json_generic_mango_v1 
	name="" 
	version="" 
	xmlns:p="json_generic_mango_v1" 
	xmlns:xsi="http://www.w3.org/2001/XMLSchema-instance" 
	xsi:schemaLocation="json_generic_mango_v1 ../../../adapter-lib/src/main/resources/schemas/mango/json_generic_mango_v1.xsd "
	element_type_id="27"
    array_element_id="2">
 <p:session_uid element_type_param_id="1003" param_type_id="1"></p:session_uid>
  <p:state field="status">
    <p:state_value source="0" input="2" disconnected="true"></p:state_value>
    <p:state_value source="1" input="1"></p:state_value>
  </p:state>
  <p:fields>
    <p:field>
      <p:source>master_cpu_state</p:source>
      <p:input>
        <p:element_type_param_id>1</p:element_type_param_id>
        <p:param_type_id>2</p:param_type_id>
      </p:input>
    </p:field>
	<p:field>
      <p:source>slave_cpu_state</p:source>
      <p:input>
        <p:element_type_param_id>2</p:element_type_param_id>
        <p:param_type_id>2</p:param_type_id>
      </p:input>
    </p:field>
	<p:field>
      <p:source>master_cpu_function</p:source>
      <p:input>
        <p:element_type_param_id>3</p:element_type_param_id>
        <p:param_type_id>2</p:param_type_id>
      </p:input>
    </p:field>
	<p:field>
      <p:source>slave_cpu_function</p:source>
      <p:input>
        <p:element_type_param_id>4</p:element_type_param_id>
        <p:param_type_id>2</p:param_type_id>
      </p:input>
    </p:field>
    <p:field>
      <p:source>device_error_t1</p:source>
      <p:input>
        <p:element_type_param_id>5</p:element_type_param_id>
        <p:param_type_id>2</p:param_type_id>
      </p:input>
    </p:field>
   	<p:field>
      <p:source>device_error_t2</p:source>
      <p:input>
        <p:element_type_param_id>6</p:element_type_param_id>
        <p:param_type_id>2</p:param_type_id>
      </p:input>
    </p:field>
   	<p:field>
      <p:source>device_error_t3</p:source>
      <p:input>
        <p:element_type_param_id>7</p:element_type_param_id>
        <p:param_type_id>2</p:param_type_id>
      </p:input>
    </p:field>
   	<p:field>
      <p:source>device_error_t4</p:source>
      <p:input>
        <p:element_type_param_id>8</p:element_type_param_id>
        <p:param_type_id>2</p:param_type_id>
      </p:input>
    </p:field>
   	<p:field>
      <p:source>device_error_t5</p:source>
      <p:input>
        <p:element_type_param_id>9</p:element_type_param_id>
        <p:param_type_id>2</p:param_type_id>
      </p:input>
    </p:field>
    <p:field>
      <p:source>device_error_t6</p:source>
      <p:input>
        <p:element_type_param_id>10</p:element_type_param_id>
        <p:param_type_id>2</p:param_type_id>
      </p:input>
    </p:field>
   	<p:field>
      <p:source>device_error_t7</p:source>
      <p:input>
        <p:element_type_param_id>11</p:element_type_param_id>
        <p:param_type_id>2</p:param_type_id>
      </p:input>
    </p:field>
   	<p:field>
      <p:source>device_error_t8</p:source>
      <p:input>
        <p:element_type_param_id>12</p:element_type_param_id>
        <p:param_type_id>2</p:param_type_id>
      </p:input>
    </p:field>
   	<p:field>
      <p:source>device_error_t9</p:source>
      <p:input>
        <p:element_type_param_id>13</p:element_type_param_id>
        <p:param_type_id>2</p:param_type_id>
      </p:input>
    </p:field>
   	<p:field>
      <p:source>device_error_t10</p:source>
      <p:input>
        <p:element_type_param_id>14</p:element_type_param_id>
        <p:param_type_id>2</p:param_type_id>
      </p:input>
    </p:field>
   	<p:field>
      <p:source>device_error_t11</p:source>
      <p:input>
        <p:element_type_param_id>15</p:element_type_param_id>
        <p:param_type_id>2</p:param_type_id>
      </p:input>
    </p:field>
   	<p:field>
      <p:source>device_error_t12</p:source>
      <p:input>
        <p:element_type_param_id>16</p:element_type_param_id>
        <p:param_type_id>2</p:param_type_id>
      </p:input>
    </p:field>
   	<p:field>
      <p:source>device_error_t13</p:source>
      <p:input>
        <p:element_type_param_id>17</p:element_type_param_id>
        <p:param_type_id>2</p:param_type_id>
      </p:input>
    </p:field>
   	<p:field>
      <p:source>device_error_t14</p:source>
      <p:input>
        <p:element_type_param_id>18</p:element_type_param_id>
        <p:param_type_id>2</p:param_type_id>
      </p:input>
    </p:field>
   	<p:field>
      <p:source>device_error_t15</p:source>
      <p:input>
        <p:element_type_param_id>19</p:element_type_param_id>
        <p:param_type_id>2</p:param_type_id>
      </p:input>
    </p:field>
   	<p:field>
      <p:source>device_error_t16</p:source>
      <p:input>
        <p:element_type_param_id>20</p:element_type_param_id>
        <p:param_type_id>2</p:param_type_id>
      </p:input>
    </p:field>
   	<p:field>
      <p:source>device_error_t17</p:source>
      <p:input>
        <p:element_type_param_id>21</p:element_type_param_id>
        <p:param_type_id>2</p:param_type_id>
      </p:input>
    </p:field>
   	<p:field>
      <p:source>device_error_t18</p:source>
      <p:input>
        <p:element_type_param_id>22</p:element_type_param_id>
        <p:param_type_id>2</p:param_type_id>
      </p:input>
    </p:field>
   	<p:field>
      <p:source>device_error_t19</p:source>
      <p:input>
        <p:element_type_param_id>23</p:element_type_param_id>
        <p:param_type_id>2</p:param_type_id>
      </p:input>
    </p:field>
   	<p:field>
      <p:source>device_error_t20</p:source>
      <p:input>
        <p:element_type_param_id>24</p:element_type_param_id>
        <p:param_type_id>2</p:param_type_id>
      </p:input>
    </p:field>
   	<p:field>
      <p:source>device_error_t21</p:source>
      <p:input>
        <p:element_type_param_id>25</p:element_type_param_id>
        <p:param_type_id>2</p:param_type_id>
      </p:input>
    </p:field>
  </p:fields>
   <p:alarms>
    <p:alarm source="upd_fail_1er1" active_value="true" alarm_config_id="30090027"></p:alarm>
    <p:alarm source="upd_fail_1er2" active_value="true" alarm_config_id="30100027"></p:alarm>
    <p:alarm source="upd_fail_1es0" active_value="true" alarm_config_id="30110027"></p:alarm>
    <p:alarm source="upd_fail_1e01" active_value="true" alarm_config_id="30120027"></p:alarm>
    <p:alarm source="upd_fail_1e02" active_value="true" alarm_config_id="30130027"></p:alarm>
    <p:alarm source="upd_fail_1e03" active_value="true" alarm_config_id="30140027"></p:alarm>
    <p:alarm source="upd_fail_1e04" active_value="true" alarm_config_id="30150027"></p:alarm>
    <p:alarm source="upd_fail_1e05" active_value="true" alarm_config_id="30160027"></p:alarm>
    <p:alarm source="upd_fail_ct02_1" active_value="true" alarm_config_id="30170027"></p:alarm>
    <p:alarm source="upd_fail_ct02_2" active_value="true" alarm_config_id="30180027"></p:alarm>
    <p:alarm source="process_error" active_value="true" alarm_config_id="040027"></p:alarm>
    <p:alarm source="master_comm" active_value="true" alarm_config_id="050027"></p:alarm>
    <p:alarm source="slave_comm" active_value="true" alarm_config_id="060027"></p:alarm>
  </p:alarms>
</p:json_generic_mango_v1>
