<?xml version="1.0" encoding="UTF-8"?>
<p:json_generic_mango_v1 name="" version=""
  xmlns:p="json_generic_mango_v1"
  xmlns:xsi="http://www.w3.org/2001/XMLSchema-instance" xsi:schemaLocation="json_generic_mango_v1 ../../../adapter-lib/src/main/resources/schemas/mango/json_generic_mango_v1.xsd " element_type_id="65">
  <p:session_uid element_type_param_id="1003" param_type_id="1"></p:session_uid>
  <p:state field="status">
    <p:state_value source="0" input="2" disconnected="true"></p:state_value>
    <p:state_value source="1" input="1"></p:state_value>
  </p:state>
  <p:fields>
    <p:field>
      <p:source>bypass</p:source>
      <p:input>
        <p:element_type_param_id>1</p:element_type_param_id>
        <p:param_type_id>2</p:param_type_id>
      </p:input>
    </p:field>
	  <p:field>
      <p:source>power_fail</p:source>
      <p:input>
        <p:element_type_param_id>2</p:element_type_param_id>
        <p:param_type_id>2</p:param_type_id>
      </p:input>
    </p:field>
	  <p:field>
      <p:source>temperature</p:source>
      <p:input>
        <p:element_type_param_id>3</p:element_type_param_id>
        <p:param_type_id>2</p:param_type_id>
      </p:input>
    </p:field>
	  <p:field>
      <p:source>L1</p:source>
      <p:input>
        <p:element_type_param_id>4</p:element_type_param_id>
        <p:param_type_id>2</p:param_type_id>
      </p:input>
    </p:field>
	  <p:field>
      <p:source>L2</p:source>
      <p:input>
        <p:element_type_param_id>5</p:element_type_param_id>
        <p:param_type_id>2</p:param_type_id>
      </p:input>
    </p:field>
	  <p:field>
      <p:source>L3</p:source>
      <p:input>
        <p:element_type_param_id>6</p:element_type_param_id>
        <p:param_type_id>2</p:param_type_id>
      </p:input>
    </p:field>
	  <p:field>
      <p:source>autonomy</p:source>
      <p:input>
        <p:element_type_param_id>7</p:element_type_param_id>
        <p:param_type_id>2</p:param_type_id>
      </p:input>
    </p:field>
  </p:fields>
  <p:alarms>
    <p:alarm source="alarm_battery_bad" active_value="true" alarm_config_id="020065"></p:alarm>
    <p:alarm source="alarm_on_battery" active_value="true" alarm_config_id="030065"></p:alarm>
    <p:alarm source="alarm_low_battery" active_value="true" alarm_config_id="040065"></p:alarm>
    <p:alarm source="alarm_depleted_battery" active_value="true" alarm_config_id="050065"></p:alarm>
    <p:alarm source="alarm_temperature_bad" active_value="true" alarm_config_id="060065"></p:alarm>
    <p:alarm source="alarm_input_bad" active_value="true" alarm_config_id="070065"></p:alarm>
    <p:alarm source="alarm_output_overload" active_value="true" alarm_config_id="080065"></p:alarm>
    <p:alarm source="alarm_ups_off_as_requested" active_value="true" alarm_config_id="090065"></p:alarm>
    <p:alarm source="alarm_charger_failed" active_value="true" alarm_config_id="100065"></p:alarm>
    <p:alarm source="alarm_ups_output_off" active_value="true" alarm_config_id="110065"></p:alarm>
    <p:alarm source="alarm_fan_failure" active_value="true" alarm_config_id="120065"></p:alarm>
    <p:alarm source="alarm_fuse_failure" active_value="true" alarm_config_id="130065"></p:alarm>
    <p:alarm source="alarm_diagnostic_test_failed" active_value="true" alarm_config_id="140065"></p:alarm>
    <p:alarm source="alarm_communications_lost" active_value="true" alarm_config_id="150065"></p:alarm>
    <p:alarm source="alarm_awaiting_power" active_value="true" alarm_config_id="160065"></p:alarm>
    <p:alarm source="alarm_shutdown_pending" active_value="true" alarm_config_id="170065"></p:alarm>
    <p:alarm source="alarm_shutdown_imminent" active_value="true" alarm_config_id="180065"></p:alarm>
    <p:alarm source="alarm_test_in_progress" active_value="true" alarm_config_id="190065"></p:alarm>
    <p:alarm source="alarm_general_fail" active_value="true" alarm_config_id="200065"></p:alarm>
  </p:alarms>
</p:json_generic_mango_v1>